,level_0,id,docid,title,author,date,genre,lhs,match,rhs,Level 1,Level 2,domain,comment,index,Unnamed: 0,Unnamed: 0.1,Context before,token,Context after
66,104,104,A56192,"The Popish royall favourite: or, a full discovery of His Majesties extraordinary favours to, and protections of notorious papists, priestes, Jesuites, against all prosecutions and penalties of the laws enacted against them notwithstanding his many royall proclamations, declarations, and protestations to the contrary: as likewise of a most desperate long prosecuted designe to set up popery, and extirpate the Protestant religion by degrees, in this our kealme [sic] of England, and all His Majesties dominions. Manifested by sundry letters of grace, warrants, writings under the Kings own signe-manuall, privy-signet, his privy-councels, and Secretary Windebanks hands and seals, by divers orders and proceedings in open sessions at Newgate, in the Kings Bench, and elsewhere ... Collected and published by authority of Parliament: by William Prynne, of Lincolns Inne, Esquire.","Prynne, William",1643,legal,"beene Dppressed under the raigne of Queene Elizabeth . But as it oft times happens , that those who ",ardent,"ly desire any thing , imagine with themselves , that it is very easie to doe , or to be obtained , a",Y,MET,want,,104,,,"beene dppressed under the raigne of queene elizabeth . but as it oft times happens , that those who",ardently,"desire any thing , imagine with themselves , that it is very easie to doe , or to be obtained , a"
67,105,105,K032335000.a1,"Cato: A tragedy. As it is acted at the Theatre-Royal in Drury-Lane, by Her Majesty's servants. By Mr. Addison.","Addison, Joseph",1713,drama_tragedy,'ry Moment quickned to the Cour_e . Cato has u_ed me Ill : He has refu_ed His Daughter Marcia to my ,ardent,"Vows . Be_ides , his baffled Arms and ruined Cau_e Are Barrs to my Ambition . Cae_ar 's Favour , Th",Y,MET,dedication,,105,,,'ry moment quickned to the cour_e . cato has u_ed me ill : he has refu_ed his daughter marcia to my,ardent,"vows . be_ides , his baffled arms and ruined cau_e are barrs to my ambition . cae_ar 's favour , th"
68,107,107,A36625.a1,"Fables ancient and modern translated into verse from Homer, Ovid, Boccace, & Chaucer, with orginal poems, by Mr. Dryden.","Dryden, John",1700,poetry,"is Foes ; and thrice he slew the slain . The Master saw the Madness rise ; His glowing Cheeks , his ",ardent,"Eyes ; And while He Heav'n and Earth defy'd , Chang'd his Hand , and check'd his Pride . He chose a",Y,MET,emotion,,107,,,"is foes ; and thrice he slew the slain . the master saw the madness rise ; his glowing cheeks , his",ardent,"eyes ; and while he heav'n and earth defy'd , chang'd his hand , and check'd his pride . he chose a"
69,108,108,A28980.5,"Experiments, notes, &c. about the mechanical origine or production of divers particular qualities among which is inferred a discourse of the imperfection of the chymist's doctrine of qualities : together with some reflections upon the hypothesis of alcali and acidum / by the Honourable Robert Boyle ...","Boyle, Robert",1675,science,"Chymists , and we have tried the like in artificial Wine made of Raisins , that the phlegm , but no ",ardent,"Spirit , will ascend . But when this Liquour is reduced to Wine by fermentation , which is accompan",Y,LIT,,,108,,,"chymists , and we have tried the like in artificial wine made of raisins , that the phlegm , but no",ardent,"spirit , will ascend . but when this liquour is reduced to wine by fermentation , which is accompan"
70,109,109,A39669.a25,"The method of grace, in bringing home the eternal redemption contrived by the Father, and accomplished by the Son through the effectual application of the spirit unto God's elect, being the second part of Gospel redemption : wherein the great mysterie of our union and communion with Christ is opened and applied, unbelievers invited, false pretenders convicted, every mans claim to Christ examined, and the misery of Christless persons discovered and bewailed / by John Flavell ...","Flavell, John",1681,sermons,"dly , Alonging thirsting frame of spirit accompanies the new creation : the desires of the soul are ",ardent,"after Christ : never did the hireling long for the shadow , as the weary soul doth for Christ , and",Y,MET,want,,109,,,"dly , alonging thirsting frame of spirit accompanies the new creation : the desires of the soul are",ardent,"after christ : never did the hireling long for the shadow , as the weary soul doth for christ , and"
71,110,110,A27276.1,"All the histories and novels written by the late ingenious Mrs. Behn entire in one volume : together with the history of the life and memoirs of Mrs. Behn never before printed / by one of the fair sex ; intermix'd with pleasant love-letters that pass'd betwixt her and Minheer Van Brun, a Dutch merchant, with her character of the countrey and lover : and her love-letters to a gentleman in England.","Behn, Aphra",1688,fiction,"s Inclination that di_po_es Hearts , and not Rea_on . Agnes is beautiful enough to in_pire the most ",ardent,"Pa__ion , and vertuous enough to de_erve the first Fortunes in the World . I ask her , once more , ",Y,MET,emotion,,110,,,"s inclination that di_po_es hearts , and not rea_on . agnes is beautiful enough to in_pire the most",ardent,"pa__ion , and vertuous enough to de_erve the first fortunes in the world . i ask her , once more ,"
72,111,111,A56171.a44,"Hidden workes of darkenes brought to publike light, or, A necessary introdvction to the history of the Archbishop of Canterbvrie's triall discovering to the world the severall secret dangerous plots, practices, proceedings of the Pope and his confederates, both at home and in forraigne parts, to undermine the Protestant religion, usher the whole body of popery into our church, and reduce all our realms to their ancient vassalage to the Sea of Rome, by insensible steps and degrees : from the first marriage treaty with Spain, anno 1617, till this present : together with the true originals of the late Scottish troubles, Irish rebellion and English civill warres: manifested by sundry ... papers, found among Secretary Windebankes, master Thomas Windebankes, the lord Cottingtons and Arch-bishop of Canterburies writings, and some late intercepted letters from forraigne parts / by William Prynne ...","Prynne, William",1645,letters,J_sutes in opinion and practice ; which caused your royall Father ( with so much pi _us wisdome and ,ardent,"zeale ) to endeavour the suppressing of them , as well at @ as in the neighbour Countries : and you",Y,MET,dedication,,111,,,j_sutes in opinion and practice ; which caused your royall father ( with so much pi _us wisdome and,ardent,"zeale ) to endeavour the suppressing of them , as well at @ as in the neighbour countries : and you"
73,112,112,A70803,"A decad of caveats to the people of England of general use in all times, but most seasonable in these, as having a tendency to the satisfying such as are not content with the present government as it is by law establish'd, an aptitude to the setling the minds of such as are but seekers and erraticks in religion an aim at the uniting of our Protestant-dissenters in church and state : whereby the worst of all conspiracies lately rais'd against both, may be the greatest blessing, which could have happen'd to either of them : to which is added an appendix in order to the conviction of those three enemies to the deity, the atheist, the infidel and the setter up of science to the prejudice of religion / by Thomas Pierce ...","Pierce, Thomas",1679,prose,"us . We would not Pray , or hear Sermons , or communicate in Sacraments , or might we have our mo_t ",ardent,"Wi_hes , we would not go to Heaven without them . And it is with This Charity that I indeavour in o",Y,MET,want,,112,,,"us . we would not pray , or hear sermons , or communicate in sacraments , or might we have our mo_t",ardent,"wi_hes , we would not go to heaven without them . and it is with this charity that i indeavour in o"
74,115,115,K107084000,The advancement and reformation of modern poetry: A critical discourse. In two parts. .. By Mr Dennis.,"Dennis, John",1701,prose,"which made the unpardonable enormity of that crime was this , that when God had created him with an ",ardent,"de_ire of Happine_s , and had created him of _uch a nature , that his full and his perfect Happine_",Y,MET,want,,115,,,"which made the unpardonable enormity of that crime was this , that when god had created him with an",ardent,"de_ire of happine_s , and had created him of _uch a nature , that his full and his perfect happine_"
75,116,116,K107398002.25,"Original letters: familiar, moral and critical. By Mr. Dennis. In two volumes. .. [pt.2]","Dennis, John",1717,letters,"n , and the other inclines us to _ubmit to Plea_ure ; the one of which is Pride , and the other the ",ardent,De_ire of Happine_s ; and therefore Rochefoucault is in the right in his 29th Reflection . Il faut ,Y,MET,want,,116,,,"n , and the other inclines us to _ubmit to plea_ure ; the one of which is pride , and the other the",ardent,de_ire of happine_s ; and therefore rochefoucault is in the right in his 29th reflection . il faut
76,118,118,A27315.a37,"Poems upon several occasions with, A voyage to the island of love / by Mrs. A. Behn.","Behn, Aphra",1684,songs,"To practice o'er New Blisses . II . The Sun it self with Love does conspire , And sends abroad his ",ardent,"Fire , And kindly seems to bid us retire , And shade us from his Glory ; Then come , my Phillis , d",Y,LIT,,,118,,,"to practice o'er new blisses . ii . the sun it self with love does conspire , and sends abroad his",ardent,"fire , and kindly seems to bid us retire , and shade us from his glory ; then come , my phillis , d"
77,119,119,11704469,"New experiments, and observations, made upon the icy noctiluca imparted in a letter to a friend living in the country : to which is annexed A chymical paradox / by Robert Boyle.","Boyle, Robert",1682,science+letters,"t having no more Oyls fit for my turn , I next tryed whether I could dissolve our shining Matter in ",Ardent,"Spirits , which are thought by Chymists to be of near Consanguinity with distill'd Oyls ; ( not now",Y,LIT,,,119,,,"t having no more oyls fit for my turn , i next tryed whether i could dissolve our shining matter in",Ardent,"spirits , which are thought by chymists to be of near consanguinity with distill'd oyls ; ( not now"
78,120,120,12259744,"The unfortunate court-favourites of England exemplified in some remarks upon the lives, actions, and fatal fall of divers great men, who have been favourites to several English kings and queens ... / by R.B.","Crouch, Nathaniel",1695,biography/memoirs,"still some hope remaining , by the dayly observation of your Noble Personage , your Justice , your ",ardent,"love to your Countrey , and likewise the great love the People have toward you , and should think t",Y,MET,emotion,,120,,,"still some hope remaining , by the dayly observation of your noble personage , your justice , your",ardent,"love to your countrey , and likewise the great love the people have toward you , and should think t"
79,121,121,A30351,"The history of the persecution of the valleys of Piedmont containing an account of what hath passed in the dissipation of the churches and the inhabitants of the valleys, which happened in the year 1686.","Burnet, Gilbert",1688,prose,"ors whereof from the beginning to the end , shewed all the marks of a tender compassion , and of an ",ardent,"Charity . But it was not only in Geneva , that the Waldenses have found such consolation , but they",Y,MET,dedication,,121,,,"ors whereof from the beginning to the end , shewed all the marks of a tender compassion , and of an",ardent,"charity . but it was not only in geneva , that the waldenses have found such consolation , but they"
80,122,122,K036148000,"An essay upon publick spirit; being a satyr in prose upon the manners and luxury of the times, the chief sources of our present parties and divisions. By Mr. Dennis:","Dennis, John",1711,satire,"pirit is , and in what Condition 'tis at pre_ent among us ? Publick Spirit may be defin'd to be the ",ardent,"Love of one's Country , affecting us with a zealous Concern for its Honour and Intere_t , and in_pi",Y,MET,emotion,,122,,,"pirit is , and in what condition 'tis at pre_ent among us ? publick spirit may be defin'd to be the",ardent,"love of one's country , affecting us with a zealous concern for its honour and intere_t , and in_pi"
81,123,123,K036148000,"An essay upon publick spirit; being a satyr in prose upon the manners and luxury of the times, the chief sources of our present parties and divisions. By Mr. Dennis:","Dennis, John",1711,satire,"loves his Country-men , loves their Cu_toms and Manners . Thus the Macedonians , who with the mo_t ",ardent,"Alacrity , left the Sun and the Soil of Greece to follow their young Heroe , rather cho_e to part w",Y,MET,dedication,,123,,,"loves his country-men , loves their cu_toms and manners . thus the macedonians , who with the mo_t",ardent,"alacrity , left the sun and the soil of greece to follow their young heroe , rather cho_e to part w"
82,124,124,K036148000,"An essay upon publick spirit; being a satyr in prose upon the manners and luxury of the times, the chief sources of our present parties and divisions. By Mr. Dennis:","Dennis, John",1711,satire,"ture of Publick Spirit , and from the Definition which has been given of it . Publick Spirit is the ",ardent,"Love of one's Country , affecting us with a zealous Concern for its Honour and Intere_t , and in_pi",Y,MET,emotion,,124,,,"ture of publick spirit , and from the definition which has been given of it . publick spirit is the",ardent,"love of one's country , affecting us with a zealous concern for its honour and intere_t , and in_pi"
83,125,125,A70588,An apology against a pamphlet call'd A modest confutation of the animadversions upon the remonstrant against Smectymnuus,"Milton, John",1642,prose,"n_ay any word therein ; as we may reade in Sleiden . Yea he defends his eagerne__e , as being of an ",ardent,"_pirit , and one who could not write a dull _tile : and affirm'd hee thought it Gods will to have t",Y,MET,dedication,,125,,,"n_ay any word therein ; as we may reade in sleiden . yea he defends his eagerne__e , as being of an",ardent,"_pirit , and one who could not write a dull _tile : and affirm'd hee thought it gods will to have t"
84,126,126,A39669.a29,"The method of grace, in bringing home the eternal redemption contrived by the Father, and accomplished by the Son through the effectual application of the spirit unto God's elect, being the second part of Gospel redemption : wherein the great mysterie of our union and communion with Christ is opened and applied, unbelievers invited, false pretenders convicted, every mans claim to Christ examined, and the misery of Christless persons discovered and bewailed / by John Flavell ...","Flavell, John",1681,sermons,rom self - dependance : he makes you to admire the riches of free grace : he makes you to long more ,ardent,"ly for heaven , and entertain the sweeter thoughts of death : and doth not the Lord then make blesse",Y,MET,want,,126,,,rom self - dependance : he makes you to admire the riches of free grace : he makes you to long more,ardently,"for heaven , and entertain the sweeter thoughts of death : and doth not the lord then make blesse"
85,127,127,PLEB,The Plebeian,"Steele, Richard",1719,magazine,"his salutary scheme , then I will venture to affirm , that there is no one expedient to gratify the ",ardent,"desires of those gentlemen , to deliver them from the disquietude of those that are in , and from t",Y,MET,want,,127,,,"his salutary scheme , then i will venture to affirm , that there is no one expedient to gratify the",ardent,"desires of those gentlemen , to deliver them from the disquietude of those that are in , and from t"
86,129,129,A29013,"Of the high veneration man's intellect owes to God, peculiarly for his wisedom and power by a Fellow of the Royal Society.","Boyle, Robert",1685,prose,"Noblene_s of their Nature , the _plendidne_s of their Apparitions , and the profound Veneration and ",ardent,. Devotion which they pay'd to their Creatour ; becau_e we are wont to e_timate remote things by co,Y,MET,dedication,,129,,,"noblene_s of their nature , the _plendidne_s of their apparitions , and the profound veneration and",ardent,. devotion which they pay'd to their creatour ; becau_e we are wont to e_timate remote things by co
87,130,130,A29013,"Of the high veneration man's intellect owes to God, peculiarly for his wisedom and power by a Fellow of the Royal Society.","Boyle, Robert",1685,prose,"s and Acclamations , the Nativity of the World , and I think they may well be _uppo_ed , to have an ",ardent,"de_ire to obtain a farther knowledge of God Him_elf . Since , as an Apo_tle a__ures us , they earne",Y,MET,want,,130,,,"s and acclamations , the nativity of the world , and i think they may well be _uppo_ed , to have an",ardent,"de_ire to obtain a farther knowledge of god him_elf . since , as an apo_tle a__ures us , they earne"
88,131,131,A47906,"The reformed Catholique, or, The true Protestant","L'Estrange, Roger",1679,prose,"our for the Irish , the Parisian , and several other Massacres ; no man a higher Esteem , or a more ",Ardent,"affection for Protestancy it self , ( so far as the Profession of the Church of England is intended",Y,MET,emotion,,131,,,"our for the irish , the parisian , and several other massacres ; no man a higher esteem , or a more",Ardent,"affection for protestancy it self , ( so far as the profession of the church of england is intended"
89,133,133,A39669.a28,"The method of grace, in bringing home the eternal redemption contrived by the Father, and accomplished by the Son through the effectual application of the spirit unto God's elect, being the second part of Gospel redemption : wherein the great mysterie of our union and communion with Christ is opened and applied, unbelievers invited, false pretenders convicted, every mans claim to Christ examined, and the misery of Christless persons discovered and bewailed / by John Flavell ...","Flavell, John",1681,sermons,"2 . 3 , 4 , 5 . Fourthly , The streams of Christs obedience flowed from the spring and fountain of ",ardent,"love to God . Joh . 14 . 31 . But that the world may know that I love the Father , and as the Fathe",Y,MET,emotion,,133,,,"2 . 3 , 4 , 5 . fourthly , the streams of christs obedience flowed from the spring and fountain of",ardent,"love to god . joh . 14 . 31 . but that the world may know that i love the father , and as the fathe"
90,134,134,A56200,"Sad and serious politicall considerations touching the invasive war against our Presbyterian Protestant brethren in Scotland, their late great overthrow, and the probable dangerous consequences thereof to both nations and the Prorestant [sic] religion which may serve as a satisfactory apology for such ministers and people, who out of conscience did not observe the publike thanksgiving against their covenant, for the great slaughter of those their brethren in covenant.","Prynne, William",1650,prose,"ew converted Christians shall be ; how holy , learned and unanimous their Ministers should be , how ",ardent,and studious they shall be in communicating the Gospel of Christ to such as yet sit in darknesse an,Y,MET,dedication,,134,,,"ew converted christians shall be ; how holy , learned and unanimous their ministers should be , how",ardent,and studious they shall be in communicating the gospel of christ to such as yet sit in darknesse an
91,135,135,A71330,"A preservative against popery. [Parts 1-2.] being some plain directions to unlearned Protestants, how to dispute with Romish priests, the first part / by Will. Sherlock ...","Sherlock, William",1688,prose,"uiring the exercise of a great many Vertues ; an abhorrence and detestation of our Sins , great and ",ardent,"Passions of Love and Devotion , firm Resolutions of Living to him , who Died for us , Forgiveness o",Y,MET,dedication/emotion,,135,,,"uiring the exercise of a great many vertues ; an abhorrence and detestation of our sins , great and",ardent,"passions of love and devotion , firm resolutions of living to him , who died for us , forgiveness o"
92,136,136,A30389.a78,"The memoires of the lives and actions of James and William, Dukes of Hamilton and Castleherald, &c. in which an account is given of the rise and progress of the civil wars of Scotland, with other great transactions both in England and Germany, from the year 1625, to the year 1652 : together with many letters, instructions, and other papers, written by King Charles the I : never before published : all drawn out of, or copied from the originals / by Gilbert Burnet ; in seven books.","Burnet, Gilbert",1677,letters,"ds , trusting confidently in His Majesties Iustice and Goodness , and with most Loyal Affection and ",Ardent,"Desires to have given His Majesty satisfaction , and to have returned with no less Fidelity and For",Y,MET,want,,136,,,"ds , trusting confidently in his majesties iustice and goodness , and with most loyal affection and",Ardent,"desires to have given his majesty satisfaction , and to have returned with no less fidelity and for"
93,137,137,N00887,"Christianus per ignem. Or, A disciple warming of himself and owning of his Lord: with devout and useful meditations, fetch'd out of the fire, by a Christian in a cold season, sitting before it. A work though never out of season, yet more particularly, designed for the seasonable and profitable entertainment, of them that would well employ their liesure [sic] by the fire-side. : [Three lines in Latin from Alsted]","Mather, Cotton",1702,prose+poetry,"him , according to his wicked wishes . Behold , Syrs , Behold , a Love the Flames whereof are more ",ardent,", than those at which you would now warm your selves . But I am very prone to suspect , that there ",Y,MET,emotion,extended,137,,,"him , according to his wicked wishes . behold , syrs , behold , a love the flames whereof are more",ardent,", than those at which you would now warm your selves . but i am very prone to suspect , that there"
94,139,139,N00887,"Christianus per ignem. Or, A disciple warming of himself and owning of his Lord: with devout and useful meditations, fetch'd out of the fire, by a Christian in a cold season, sitting before it. A work though never out of season, yet more particularly, designed for the seasonable and profitable entertainment, of them that would well employ their liesure [sic] by the fire-side. : [Three lines in Latin from Alsted]","Mather, Cotton",1702,prose+poetry,"m I ? A principle , as cold , as the Venemous Juice , with which the Salamander does Extinguish the ",ardent,"Coals on which it is cast , [ whence the Vulgar Error , of its Living in the Fire ] surely hath pos",Y,LIT,,,139,,,"m i ? a principle , as cold , as the venemous juice , with which the salamander does extinguish the",ardent,"coals on which it is cast , [ whence the vulgar error , of its living in the fire ] surely hath pos"
95,140,140,N00887,"Christianus per ignem. Or, A disciple warming of himself and owning of his Lord: with devout and useful meditations, fetch'd out of the fire, by a Christian in a cold season, sitting before it. A work though never out of season, yet more particularly, designed for the seasonable and profitable entertainment, of them that would well employ their liesure [sic] by the fire-side. : [Three lines in Latin from Alsted]","Mather, Cotton",1702,prose+poetry,"oo dangerous a Thing for me to be free withal . It surprizes the Spectators , to see Jugglers , put ",ardent,"Coals into their Mouths : But is it not more surprizing , that mens mouths are filled with Offences",Y,LIT,,,140,,,"oo dangerous a thing for me to be free withal . it surprizes the spectators , to see jugglers , put",ardent,"coals into their mouths : but is it not more surprizing , that mens mouths are filled with offences"
96,141,141,N00887,"Christianus per ignem. Or, A disciple warming of himself and owning of his Lord: with devout and useful meditations, fetch'd out of the fire, by a Christian in a cold season, sitting before it. A work though never out of season, yet more particularly, designed for the seasonable and profitable entertainment, of them that would well employ their liesure [sic] by the fire-side. : [Three lines in Latin from Alsted]","Mather, Cotton",1702,prose+poetry,"re Contrivances , which the Writers of such Curiosies do suggest ; How men may without Harm take up ",ardent,"Coals into their Hands : But I never could see it contrived , how men may Work Wickedness with thei",Y,LIT,,,141,,,"re contrivances , which the writers of such curiosies do suggest ; how men may without harm take up",ardent,"coals into their hands : but i never could see it contrived , how men may work wickedness with thei"
97,143,143,A51475.a1,The history of the League written in French by Monsieur Maimbourg ; translated into English by His Majesty's command by Mr. Dryden.,"Dryden, John",1684,letters,"th , against their Soveraign . And Lewis the Great , without employing other Arms than those of his ",Ardent,"Charity , and incomparable Zeal for the Conversion of Protestants , accompanied by the Iustice of h",Y,MET,dedication,,143,,,"th , against their soveraign . and lewis the great , without employing other arms than those of his",Ardent,"charity , and incomparable zeal for the conversion of protestants , accompanied by the iustice of h"
