,level_0,id,docid,title,author,date,genre,lhs,match,rhs,Level 1,Level 2,domain,comment,index,Unnamed: 0,Unnamed: 0.1,Context before,token,Context after
539,190,363,N00277,"Kometographia. Or A discourse concerning comets; wherein the nature of blazing stars is enquired into: with an historical account of all the comets which have appeared from the beginning of the world unto this present year, M.DC.LXXXIII. : Expressing the place in the heavens, where they were seen, their motion, forms, duration; and the remarkable events which have followed in the world, so far as thay have been by learned men observed. : As also two sermons occasioned by the late blazing stars. / By Mr. Increase Mather, teacher of a church at Boston in New-England. ; [Three lines of Scripture texts]","Mather, Increase",1683,science+sermons,he universal head of the Church . Ever since this time the Bishops of Rome have been no better then ,Blaz,"ing Stars . Four Years after this , another Comet was seen in the Moneths of April and May , & again",Y,LIT,,,190,,,he universal head of the church . ever since this time the bishops of rome have been no better then,Blazing,"stars . four years after this , another comet was seen in the moneths of april and may , & again"
540,191,455,N00277,"Kometographia. Or A discourse concerning comets; wherein the nature of blazing stars is enquired into: with an historical account of all the comets which have appeared from the beginning of the world unto this present year, M.DC.LXXXIII. : Expressing the place in the heavens, where they were seen, their motion, forms, duration; and the remarkable events which have followed in the world, so far as thay have been by learned men observed. : As also two sermons occasioned by the late blazing stars. / By Mr. Increase Mather, teacher of a church at Boston in New-England. ; [Three lines of Scripture texts]","Mather, Increase",1683,science+sermons,"eiveth from the Sun hath a physical and wonderful influence upon the Earth , so may the Beams which ",blaz,"e through a Cometical body have likewise . As to their natural operation , they may have different e",Y,LIT,,,191,,,"eiveth from the sun hath a physical and wonderful influence upon the earth , so may the beams which",blaze,"through a cometical body have likewise . as to their natural operation , they may have different e"
541,192,364,N00277,"Kometographia. Or A discourse concerning comets; wherein the nature of blazing stars is enquired into: with an historical account of all the comets which have appeared from the beginning of the world unto this present year, M.DC.LXXXIII. : Expressing the place in the heavens, where they were seen, their motion, forms, duration; and the remarkable events which have followed in the world, so far as thay have been by learned men observed. : As also two sermons occasioned by the late blazing stars. / By Mr. Increase Mather, teacher of a church at Boston in New-England. ; [Three lines of Scripture texts]","Mather, Increase",1683,science+sermons,"wondred at , if so great a Plague to the World as Mahometism , is , was preceded and attended with ",Blaz,"ing Stars , as in the after Relations will appear . Never was the dominion of any Nation spread so f",Y,LIT,,,192,,,"wondred at , if so great a plague to the world as mahometism , is , was preceded and attended with",Blazing,"stars , as in the after relations will appear . never was the dominion of any nation spread so f"
542,193,515,K072424000,Notes upon the twelve books of Paradise lost: Collected from the Spectator. Written by Mr. Addison.,"Addison, Joseph",1719,prose,"ed Seed _hall all re_tore . THE following Lines , which conclude the Poem , ri_e in a mo_t glorious ",Blaz,"e of Poetical Images and Expre__ions . HELIODOR_S in his Aeshiopicks acquaints us , that the Motion ",Y,MET,UNK,,193,,,"ed seed _hall all re_tore . the following lines , which conclude the poem , ri_e in a mo_t glorious",Blaze,"of poetical images and expre__ions . heliodor_s in his aeshiopicks acquaints us , that the motion"
543,196,230,A48420.a0,"The Life of that incomparable princess, Mary, our late sovereign lady, of ever blessed memory who departed this life, at her royal pallace at Kensington, the 28th of December, 1694.","Defoe, Daniel",1695,poetry,"gravely first with Death debate . They kindle slowly , but when once on fire , Burn on , and in the ",blaz,"e of Fame expire . Hail Princess ! hail ! thou fairest of thy Kind ! Thou shape of Angels , with an ",Y,MET,UNK,extended,196,,,"gravely first with death debate . they kindle slowly , but when once on fire , burn on , and in the",blaze,"of fame expire . hail princess ! hail ! thou fairest of thy kind ! thou shape of angels , with an"
544,197,616,A36592,"All for love, or, The world well lost a tragedy, as it is acted at the Theatre-Royal, and written in imitation of Shakespeare's stile / written by Mr. Dryden.","Dryden, John",1692,drama_tragedy,"painted Wings , the Winds That plaid about her Face : But if she smil'd , A darting Glory seem'd to ",blaz,e abroad : That Mens desiring Eyes were never weary'd ; But hung upon the Object : To soft Flutes Th,Y,MET,grandeur,,197,,,"painted wings , the winds that plaid about her face : but if she smil'd , a darting glory seem'd to",blaze,abroad : that mens desiring eyes were never weary'd ; but hung upon the object : to soft flutes th
545,198,323,N00277,"Kometographia. Or A discourse concerning comets; wherein the nature of blazing stars is enquired into: with an historical account of all the comets which have appeared from the beginning of the world unto this present year, M.DC.LXXXIII. : Expressing the place in the heavens, where they were seen, their motion, forms, duration; and the remarkable events which have followed in the world, so far as thay have been by learned men observed. : As also two sermons occasioned by the late blazing stars. / By Mr. Increase Mather, teacher of a church at Boston in New-England. ; [Three lines of Scripture texts]","Mather, Increase",1683,science+sermons,"ze is on the one side of the Comet only . Under this comes that which is called Acontias , when the ",blaz,"e is in the form of a Dart . Longitis , when it is in the form of a Lance or Spear . Xiphias , when ",Y,LIT,,,198,,,"ze is on the one side of the comet only . under this comes that which is called acontias , when the",blaze,"is in the form of a dart . longitis , when it is in the form of a lance or spear . xiphias , when"
546,199,469,A53058.a86,"Philosophical letters, or, Modest reflections upon some opinions in natural philosophy maintained by several famous and learned authors of this age, expressed by way of letters / by the thrice noble, illustrious, and excellent princess the Lady Marchioness of Newcastle.","Cavendish, Margaret",1664,letters,"he Blas of the Stars . Certainly , Madam , if this were so , then , in my judgment , when the Stars ",blaz,"e , we should have constant Winds , and the more they blaze , the more violent winds there would be ",Y,LIT,,,199,,,"he blas of the stars . certainly , madam , if this were so , then , in my judgment , when the stars",blaze,", we should have constant winds , and the more they blaze , the more violent winds there would be"
547,200,124,1598200100,"C¾sar in ®gypt. A tragedy. As it is acted at the Theatre-Royal in Drury-Lane, by His Majesty's servants. Written by Mr. Cibber.","Cibber, Colley",1725,drama,d thee . Cleo . Ptolomey ! What dreadful Ruin cou'd so soon o'ertake him ? Ant . As C¾sar round the ,blaz,"ing Pharos Led his well-order'd Troops , to quench the Flames ; Forth from the Palace , in disorder'",Y,LIT,,,200,,,d thee . cleo . ptolomey ! what dreadful ruin cou'd so soon o'ertake him ? ant . as c¾sar round the,blazing,"pharos led his well-order'd troops , to quench the flames ; forth from the palace , in disorder'"
548,201,592,45578295,"The history of the Kingdom of Scotland. Containing an account of the original of that nation, and of the most remarkable transactions and revolutions during the reigns of seventy two kings and queens, to the seventh year of King William III. Comprehending variety of state intreagues, strange accidents, prodigies, and other memorable occurrences. : With a list of the present nobility of that kingdom. / By R.B.","Crouch, Nathaniel",1696,prose,"ged , broke and killed the King , ( and hurt the Earl of Angus . ) The day before the Kings death a ",Blaz,ing Star appeared . The year before a Person who pretended to be an Hermaphrodit was buried alive fo,Y,LIT,,,201,,,"ged , broke and killed the king , ( and hurt the earl of angus . ) the day before the kings death a",Blazing,star appeared . the year before a person who pretended to be an hermaphrodit was buried alive fo
549,202,341,N00277,"Kometographia. Or A discourse concerning comets; wherein the nature of blazing stars is enquired into: with an historical account of all the comets which have appeared from the beginning of the world unto this present year, M.DC.LXXXIII. : Expressing the place in the heavens, where they were seen, their motion, forms, duration; and the remarkable events which have followed in the world, so far as thay have been by learned men observed. : As also two sermons occasioned by the late blazing stars. / By Mr. Increase Mather, teacher of a church at Boston in New-England. ; [Three lines of Scripture texts]","Mather, Increase",1683,science+sermons,"be at hand ; also the experience both of the former , and of this present age declareth , that when ",Blaz,"ing Stars have been seen , great mutations and miseries have come upon Mortals , as will by the subs",Y,LIT,,,202,,,"be at hand ; also the experience both of the former , and of this present age declareth , that when",Blazing,"stars have been seen , great mutations and miseries have come upon mortals , as will by the subs"
550,203,369,N00277,"Kometographia. Or A discourse concerning comets; wherein the nature of blazing stars is enquired into: with an historical account of all the comets which have appeared from the beginning of the world unto this present year, M.DC.LXXXIII. : Expressing the place in the heavens, where they were seen, their motion, forms, duration; and the remarkable events which have followed in the world, so far as thay have been by learned men observed. : As also two sermons occasioned by the late blazing stars. / By Mr. Increase Mather, teacher of a church at Boston in New-England. ; [Three lines of Scripture texts]","Mather, Increase",1683,science+sermons,"s poysoned . Culinus the King of Scotland , Alhaca the King of Corduba in Spain died . A.D. 984 . A ",Blaz,"ing Star was seen . An Earth quake , Wars , Plague , Famine followed , The Emperour and the Pope die",Y,LIT,,,203,,,"s poysoned . culinus the king of scotland , alhaca the king of corduba in spain died . a.d. 984 . a",Blazing,"star was seen . an earth quake , wars , plague , famine followed , the emperour and the pope die"
551,205,438,N00277,"Kometographia. Or A discourse concerning comets; wherein the nature of blazing stars is enquired into: with an historical account of all the comets which have appeared from the beginning of the world unto this present year, M.DC.LXXXIII. : Expressing the place in the heavens, where they were seen, their motion, forms, duration; and the remarkable events which have followed in the world, so far as thay have been by learned men observed. : As also two sermons occasioned by the late blazing stars. / By Mr. Increase Mather, teacher of a church at Boston in New-England. ; [Three lines of Scripture texts]","Mather, Increase",1683,science+sermons,in Taurus . It continued for the space of fourteen dayes . As for remarkable Events attending these ,Blaz,"ing Stars , we cannot but remember what doleful things quickly followed . An unhappy War between two",Y,LIT,,,205,,,in taurus . it continued for the space of fourteen dayes . as for remarkable events attending these,Blazing,"stars , we cannot but remember what doleful things quickly followed . an unhappy war between two"
552,206,605,A36627,"The hind and the panther a poem, in three parts.","Dryden, John",1687,poetry,"you exil'd , the Ioseph whom you sold . Thus , while with heav'nly charity she spoke , A streaming ",blaz,e the silent shadows broke : Shot from the skyes a chearfull azure light ; The birds obscene to fore,Y,LIT,,,206,,,"you exil'd , the ioseph whom you sold . thus , while with heav'nly charity she spoke , a streaming",blaze,the silent shadows broke : shot from the skyes a chearfull azure light ; the birds obscene to fore
553,207,248,N00887,"Christianus per ignem. Or, A disciple warming of himself and owning of his Lord: with devout and useful meditations, fetch'd out of the fire, by a Christian in a cold season, sitting before it. A work though never out of season, yet more particularly, designed for the seasonable and profitable entertainment, of them that would well employ their liesure [sic] by the fire-side. : [Three lines in Latin from Alsted]","Mather, Cotton",1702,prose+poetry,"ion , and Professors of it , seem very forward for the Services of Christianity , and make a mighty ",Blaz,"e of Profession ; but it is not a Lasting one : It goeth away . May the God of all Grace , make all ",Y,MET,proclaim,,207,,,"ion , and professors of it , seem very forward for the services of christianity , and make a mighty",Blaze,"of profession ; but it is not a lasting one : it goeth away . may the god of all grace , make all"
554,209,401,N00277,"Kometographia. Or A discourse concerning comets; wherein the nature of blazing stars is enquired into: with an historical account of all the comets which have appeared from the beginning of the world unto this present year, M.DC.LXXXIII. : Expressing the place in the heavens, where they were seen, their motion, forms, duration; and the remarkable events which have followed in the world, so far as thay have been by learned men observed. : As also two sermons occasioned by the late blazing stars. / By Mr. Increase Mather, teacher of a church at Boston in New-England. ; [Three lines of Scripture texts]","Mather, Increase",1683,science+sermons,"pentarius , until it came to the Whale , where by reason of Occ_sus Heliacus , it disappeared . The ",Blaz,e did continually point at the Gemini . In the same night presently after Sun set it would point to ,Y,LIT,,,209,,,"pentarius , until it came to the whale , where by reason of occ_sus heliacus , it disappeared . the",Blaze,did continually point at the gemini . in the same night presently after sun set it would point to
555,210,561,K107395000.a0,"The monument: a poem sacred to the immortal memory of the best and greatest of kings, William the Third. .. By Mr. Dennis.","Dennis, John",1702,poetry,"nd thro their Squadrons mows , Their Squadrons now conceal'd in _moaky Clouds , And now reveal'd in ",blaz,"ing Sheets of Fire , And now the French grow fiercer by De_pair : And with redoubled Voice Bellona r",Y,LIT,,,210,,,"nd thro their squadrons mows , their squadrons now conceal'd in _moaky clouds , and now reveal'd in",blazing,"sheets of fire , and now the french grow fiercer by de_pair : and with redoubled voice bellona r"
556,211,531,A27315,"Poems upon several occasions with, A voyage to the island of love / by Mrs. A. Behn.","Behn, Aphra",1684,poetry,"h inspire , But onely you out of those flints strike fire , Not with a sudden Spark , a short liv'd ",Blaz,"e , Like Womens Passions in our Gilting days ; But what you fire burns with a constant flame , Like ",Y,LIT,,,211,,,"h inspire , but onely you out of those flints strike fire , not with a sudden spark , a short liv'd",Blaze,", like womens passions in our gilting days ; but what you fire burns with a constant flame , like"
557,212,5,A47607.a0,"Sion in distress, or, The groans of the Protestant Chruch [sic]","Keach, Benjamin",1681,poetry,"produce their Maxims , if they can , How _catter'd Atomes can compo_e a Man ? Who brandi_hes tho_e ",blaz,ing Signs of Wonder ? Who frights the Earth with rapid Peals of Thunder ? Who did defeat the Fatal E,Y,MET,UNK,,212,,,"produce their maxims , if they can , how _catter'd atomes can compo_e a man ? who brandi_hes tho_e",blazing,signs of wonder ? who frights the earth with rapid peals of thunder ? who did defeat the fatal e
558,213,123,1598200100,"C¾sar in ®gypt. A tragedy. As it is acted at the Theatre-Royal in Drury-Lane, by His Majesty's servants. Written by Mr. Cibber.","Cibber, Colley",1725,drama,"dread Phalaric Darts , That kindle as they fly , he fires the City ; Nor spares our Altars from the ",blaz,"ing Ruin ! And now far casting o'er the Main his Eye , With trembling Indignation he beheld His dist",Y,LIT,,,213,,,"dread phalaric darts , that kindle as they fly , he fires the city ; nor spares our altars from the",blazing,"ruin ! and now far casting o'er the main his eye , with trembling indignation he beheld his dist"
559,214,351,N00277,"Kometographia. Or A discourse concerning comets; wherein the nature of blazing stars is enquired into: with an historical account of all the comets which have appeared from the beginning of the world unto this present year, M.DC.LXXXIII. : Expressing the place in the heavens, where they were seen, their motion, forms, duration; and the remarkable events which have followed in the world, so far as thay have been by learned men observed. : As also two sermons occasioned by the late blazing stars. / By Mr. Increase Mather, teacher of a church at Boston in New-England. ; [Three lines of Scripture texts]","Mather, Increase",1683,science+sermons,"d , and a terrible Plague in Rome , and a remarkable Drought . When Vespasian the Emperour saw this ",Blaz,"ing Star , he joked at it , saying , it concerned the Parthians who had long hair , not him who was ",Y,LIT,,,214,,,"d , and a terrible plague in rome , and a remarkable drought . when vespasian the emperour saw this",Blazing,"star , he joked at it , saying , it concerned the parthians who had long hair , not him who was"
560,215,286,"12349900,1","Sixteen sermons preached on several subjects and occasions by the most reverend John Tillotson ... ; being the second volume, published from the originals, by Ralph Barker ...","Tillotson, John",1688,sermons,"ct neither ; for the Christian Religion kept its ground , and Paganism , after it had made a little ",Blaz,"e , died with him . Now to what Cause shall we ascribe this wonderful Success , and Prevalency of th",Y,MET,UNK,,215,,,"ct neither ; for the christian religion kept its ground , and paganism , after it had made a little",Blaze,", died with him . now to what cause shall we ascribe this wonderful success , and prevalency of th"
561,217,96,N00242.a0,"Heavens alarm to the world. Or A sermon wherein is shewed, that fearful sights and signs in heaven are the presages of great calamities at hand. By Increase Mather; teacher of a church in Boston in New-England. ; [Eleven lines of Scripture texts]","Mather, Increase",1681,sermons,"h a terrible irruption upon the Romane Empire , like a storm of hail and fire and blood , Rev. 8.7. ",blaz,"ing stars in heaven preceded those calamityes . When Attila , who they say , called himself Flagellu",Y,LIT,,,217,,,"h a terrible irruption upon the romane empire , like a storm of hail and fire and blood , rev. 8.7.",blazing,"stars in heaven preceded those calamityes . when attila , who they say , called himself flagellu"
562,219,435,N00277,"Kometographia. Or A discourse concerning comets; wherein the nature of blazing stars is enquired into: with an historical account of all the comets which have appeared from the beginning of the world unto this present year, M.DC.LXXXIII. : Expressing the place in the heavens, where they were seen, their motion, forms, duration; and the remarkable events which have followed in the world, so far as thay have been by learned men observed. : As also two sermons occasioned by the late blazing stars. / By Mr. Increase Mather, teacher of a church at Boston in New-England. ; [Three lines of Scripture texts]","Mather, Increase",1683,science+sermons,"us or Star very lucid and shining like Gold , which was encompassed with a more dilute matter . The ",Blaz,e proceeding therefrom was almost as thick as the matter in which the Nucleus was contained . April ,Y,LIT,,,219,,,"us or star very lucid and shining like gold , which was encompassed with a more dilute matter . the",Blaze,proceeding therefrom was almost as thick as the matter in which the nucleus was contained . april
563,220,372,N00277,"Kometographia. Or A discourse concerning comets; wherein the nature of blazing stars is enquired into: with an historical account of all the comets which have appeared from the beginning of the world unto this present year, M.DC.LXXXIII. : Expressing the place in the heavens, where they were seen, their motion, forms, duration; and the remarkable events which have followed in the world, so far as thay have been by learned men observed. : As also two sermons occasioned by the late blazing stars. / By Mr. Increase Mather, teacher of a church at Boston in New-England. ; [Three lines of Scripture texts]","Mather, Increase",1683,science+sermons,"stream ; that increasing , the body of the Star decreased . Authors moreover affirm , that another ",Blaz,ing Star ( or the same again ) did appear in the two following years . As for remarkable Events atte,Y,LIT,,,220,,,"stream ; that increasing , the body of the star decreased . authors moreover affirm , that another",Blazing,star ( or the same again ) did appear in the two following years . as for remarkable events atte
564,221,560,A26967,"Now or never the holy, serious, diligent believer justified, encouraged, excited and directed, and the opposers and neglecters convinced by the light of Scripture and reason / by Richard Baxter ...","Baxter, Richard",1662,prose,") relating the proceedings to his Holine_s _omewhat partially , died _uddenly .ÑNo _ooner was this ",blaz,"e of per_ecution out , but a much fiercer was kindled again_t the Order : For under pretext of Piety",Y,MET,UNK,extended,221,,,") relating the proceedings to his holine_s _omewhat partially , died _uddenly .ñno _ooner was this",blaze,"of per_ecution out , but a much fiercer was kindled again_t the order : for under pretext of piety"
565,222,65,A53061,"Poems, and fancies written by the Right Honourable, the Lady Margaret Newcastle.","Cavendish, Margaret",1653,miscellany,"whence the Blustring Winds do rise ? May know what Thunder is , which no Man knowes , And what's a ",blaz,"ing Star , or where it goes . Whether it be a Chip , fallen from the Sun , And so goes out , when Al",Y,LIT,,,222,,,"whence the blustring winds do rise ? may know what thunder is , which no man knowes , and what's a",blazing,"star , or where it goes . whether it be a chip , fallen from the sun , and so goes out , when al"
566,223,419,N00277,"Kometographia. Or A discourse concerning comets; wherein the nature of blazing stars is enquired into: with an historical account of all the comets which have appeared from the beginning of the world unto this present year, M.DC.LXXXIII. : Expressing the place in the heavens, where they were seen, their motion, forms, duration; and the remarkable events which have followed in the world, so far as thay have been by learned men observed. : As also two sermons occasioned by the late blazing stars. / By Mr. Increase Mather, teacher of a church at Boston in New-England. ; [Three lines of Scripture texts]","Mather, Increase",1683,science+sermons,"not be numbred because they would sometimes sparkle out , and otherwhile abscond from the eye . The ",blaz,"e was narrow near the Star , but broad at a distance from it . At its first appearance it bended lik",Y,LIT,,,223,,,"not be numbred because they would sometimes sparkle out , and otherwhile abscond from the eye . the",blaze,"was narrow near the star , but broad at a distance from it . at its first appearance it bended lik"
567,224,569,A26387,"The address of John Dryden, laureat to His Highness, the Prince of Orange","Dryden, John",1689,satire,"Israel 's Calf , I'le burn . Copes , Crosiers , all the Trumpery of Rome , Down to great Waller 's ",blaz,"ing Hecatomb. I'le pound my Beads to Dust , and wear no more Those Pagan Bracelets of the Scarlet Wh",Y,LIT,,,224,,,"israel 's calf , i'le burn . copes , crosiers , all the trumpery of rome , down to great waller 's",blazing,"hecatomb. i'le pound my beads to dust , and wear no more those pagan bracelets of the scarlet wh"
568,225,497,A89149.5,"Poems of Mr. John Milton, both English and Latin, compos'd at several times. Printed by his true copies. / The songs were set in musick by Mr. Henry Lawes Gentleman of the Kings Chappel, and one of His Maiesties private musick. Printed and publish'd according to order.","Milton, John",1645,poetry,"ork us a perpetual peace , II . That glorious Form , that Light un_ufferable , And that _ar-beaming ",blaz,"e of Maje_ty , Wherwith he wont at Heav'ns high Councel - Table , To _it the mid_t of Trinal Unity ,",Y,MET,light,,225,,,"ork us a perpetual peace , ii . that glorious form , that light un_ufferable , and that _ar-beaming",blaze,"of maje_ty , wherwith he wont at heav'ns high councel - table , to _it the mid_t of trinal unity ,"
